{
  "$schema": "http://json-schema.org/draft-07/schema#",
  "title": "Config",
  "description": "The whole service configuration.",
  "type": "object",
  "properties": {
    "server": {
      "description": "How the HTTP listener is bound and what the transport accepts.",
      "allOf": [
        {
          "$ref": "#/definitions/ServerConfig"
        }
      ]
    },
    "engine": {
      "description": "Where `catalog-engine` is reached, and how patiently.",
      "allOf": [
        {
          "$ref": "#/definitions/EngineConfig"
        }
      ]
    },
    "auth": {
      "description": "The identity posture and the canonical resource identifiers.",
      "allOf": [
        {
          "$ref": "#/definitions/AuthConfig"
        }
      ]
    },
    "tools": {
      "description": "What bounds a tool call and what the tool set advertises.",
      "allOf": [
        {
          "$ref": "#/definitions/ToolsConfig"
        }
      ]
    },
    "response": {
      "description": "How a tool result is rendered.",
      "allOf": [
        {
          "$ref": "#/definitions/ResponseConfig"
        }
      ]
    },
    "transport": {
      "description": "The SDK transport knobs.",
      "allOf": [
        {
          "$ref": "#/definitions/TransportConfig"
        }
      ]
    },
    "health": {
      "description": "What `/-/ready` checks.",
      "allOf": [
        {
          "$ref": "#/definitions/HealthConfig"
        }
      ]
    },
    "observability": {
      "description": "What the server reports about itself.",
      "allOf": [
        {
          "$ref": "#/definitions/ObservabilityConfig"
        }
      ]
    }
  },
  "definitions": {
    "ServerConfig": {
      "description": "How the HTTP listener is bound and what the transport accepts.\n\n`allowed_hosts` has **no usable default**: the SDK's own default is loopback-only, so a\nremote deployment answers every request `403 Forbidden: Host header is not allowed` until\nthe list is set. Validation therefore refuses an empty list before the listener binds.",
      "type": "object",
      "properties": {
        "ip": {
          "description": "Server bind IP.",
          "type": "string",
          "format": "ipv4",
          "default": "0.0.0.0"
        },
        "port": {
          "description": "Server bind port.",
          "type": "integer",
          "format": "uint16",
          "minimum": 0,
          "maximum": 65535,
          "default": 8000
        },
        "mcpPath": {
          "description": "Path the MCP service is mounted at.",
          "type": "string",
          "default": "/mcp"
        },
        "allowedHosts": {
          "description": "Hostnames or `host:port` authorities accepted in the inbound `Host` header.\nRequired and non-empty — see the type documentation.",
          "type": "array",
          "items": {
            "type": "string"
          },
          "default": []
        },
        "allowedOrigins": {
          "description": "Browser origins accepted in the inbound `Origin` header. Empty leaves `Origin`\nvalidation switched off, which is what the in-cluster client needs.",
          "type": "array",
          "items": {
            "type": "string"
          },
          "default": []
        },
        "maxBodyBytes": {
          "description": "Maximum accepted POST body size, in bytes.",
          "type": "integer",
          "format": "uint",
          "minimum": 0,
          "default": 1048576
        }
      }
    },
    "EngineConfig": {
      "description": "Where `catalog-engine` is reached, and how patiently.\n\n`base_url` always points at the **API gateway**, never at the engine `Service`: every\noutbound call has to traverse `ext_authz` so the server can never do more than its caller\ncould do itself. Validation refuses a `base_url` that addresses the engine\ndirectly.",
      "type": "object",
      "properties": {
        "baseUrl": {
          "description": "Base URL of the API gateway in front of `catalog-engine`.",
          "type": "string",
          "default": ""
        },
        "apiPrefix": {
          "description": "Path prefix the gateway routes `catalog-engine` behind.",
          "type": "string",
          "default": "/api/catalog"
        },
        "timeoutMs": {
          "description": "Per-request timeout against the engine, in milliseconds.",
          "type": "integer",
          "format": "uint64",
          "minimum": 0,
          "default": 5000
        },
        "connectTimeoutMs": {
          "description": "Connect timeout against the engine, in milliseconds.",
          "type": "integer",
          "format": "uint64",
          "minimum": 0,
          "default": 1000
        },
        "maxRetries": {
          "description": "Maximum retry attempts for a request the retry policy classifies as retryable.",
          "type": "integer",
          "format": "uint8",
          "minimum": 0,
          "maximum": 255,
          "default": 1
        }
      }
    },
    "AuthConfig": {
      "description": "The identity posture and the canonical resource identifiers.\n\nThe Protected Resource Metadata document is served by Envoy, not by this process, so\n`resource` exists to match Envoy's string exactly rather than to be published from here.",
      "type": "object",
      "properties": {
        "mode": {
          "description": "What the server does with the caller's identity.",
          "allOf": [
            {
              "$ref": "#/definitions/AuthMode"
            }
          ]
        },
        "resource": {
          "description": "The canonical resource URI, matching the `resource` value Envoy publishes.",
          "type": "string",
          "default": ""
        },
        "resourceMetadataUrl": {
          "description": "The URL of the Protected Resource Metadata document Envoy serves.",
          "type": "string",
          "default": ""
        }
      }
    },
    "AuthMode": {
      "description": "What the server does with the caller's identity.\n\n`ResourceServer` is accepted by the schema — the value and this variant exist so the\ndecision is additive — but **refused by validation in v1**: starting up and silently\nbehaving as `Gateway` is how a trust boundary quietly stops existing.",
      "oneOf": [
        {
          "description": "Extract, never reject: the gateway has already authenticated and authorized.",
          "type": "string",
          "const": "gateway"
        },
        {
          "description": "Validate the bearer token ourselves. Not implemented in v1.",
          "type": "string",
          "const": "resource-server"
        }
      ]
    },
    "ToolsConfig": {
      "description": "What bounds a tool call and what the tool set advertises.\n\n`tools_list_ttl_ms` sits here rather than under `transport` because it is a property of the\ntool set, not of the wire.",
      "type": "object",
      "properties": {
        "callDeadlineSeconds": {
          "description": "Wall-clock budget for one `tools/call`, in seconds.",
          "type": "integer",
          "format": "uint64",
          "minimum": 0,
          "default": 25
        },
        "toolsListTtlMs": {
          "description": "`ttlMs` advertised with `tools/list`.",
          "type": "integer",
          "format": "uint64",
          "minimum": 0,
          "default": 3600000
        },
        "rateLimit": {
          "description": "The per-tenant token bucket.",
          "allOf": [
            {
              "$ref": "#/definitions/RateLimitConfig"
            }
          ]
        },
        "defaults": {
          "description": "Per-tool defaults and input ceilings.",
          "allOf": [
            {
              "$ref": "#/definitions/ToolDefaults"
            }
          ]
        }
      }
    },
    "RateLimitConfig": {
      "description": "The per-tenant token bucket. Buckets are per replica, so the effective cluster\nlimit is `replicas × rate`.\n\n**Off by default in v1**: it limits nothing unless `enabled` is set to `true`.",
      "type": "object",
      "properties": {
        "enabled": {
          "description": "Whether the limiter runs at all.",
          "type": "boolean",
          "default": false
        },
        "perTenantCallsPerMinute": {
          "description": "Refill rate, in calls per minute, per tenant.",
          "type": "integer",
          "format": "uint32",
          "minimum": 0,
          "default": 120
        },
        "burst": {
          "description": "Bucket capacity.",
          "type": "integer",
          "format": "uint32",
          "minimum": 0,
          "default": 20
        }
      }
    },
    "ToolDefaults": {
      "description": "Every tunable whose value is an estimate rather than a measurement. They live here, not in\nthe code, because measuring real usage will change them and a config change is not a release.\n\n**No response ceilings are among them** — there are none.",
      "type": "object",
      "properties": {
        "searchLimit": {
          "description": "Default `limit` for catalog searches.",
          "type": "integer",
          "format": "uint32",
          "minimum": 0,
          "default": 50
        },
        "relationshipLimit": {
          "description": "Default `limit` for relationship listings.",
          "type": "integer",
          "format": "uint32",
          "minimum": 0,
          "default": 50
        },
        "historyLimit": {
          "description": "Default `limit` for item history listings.",
          "type": "integer",
          "format": "uint32",
          "minimum": 0,
          "default": 10
        },
        "auditLimit": {
          "description": "Default `limit` for audit-log listings.",
          "type": "integer",
          "format": "uint32",
          "minimum": 0,
          "default": 25
        },
        "complianceWaitSeconds": {
          "description": "How long a compliance evaluation is waited on, in seconds.",
          "type": "integer",
          "format": "uint64",
          "minimum": 0,
          "default": 20
        },
        "failureSample": {
          "description": "Failing items a compliance result lists by default; the failed count stays exact.",
          "type": "integer",
          "format": "uint16",
          "minimum": 0,
          "maximum": 65535,
          "default": 50
        },
        "maxWriteBytes": {
          "description": "Ceiling on the bytes a caller may send us in one write.",
          "type": "integer",
          "format": "uint",
          "minimum": 0,
          "default": 262144
        }
      }
    },
    "ResponseConfig": {
      "description": "How a tool result is rendered.\n\n`structured_content` stays **off**: returning every result twice — as text and as\nstructured content — doubles the metric this project exists to reduce. It is a switch, not\na design choice, so a client that needs it can have it without a release.",
      "type": "object",
      "properties": {
        "structuredContent": {
          "description": "Whether results also carry `structuredContent`.",
          "type": "boolean",
          "default": false
        }
      }
    },
    "TransportConfig": {
      "description": "The SDK transport knobs, every one of them read from configuration rather than hardcoded.\n\n`legacy_session_mode` stays **on** because our only client today is handshake-era;\nrequests that negotiate `2026-07-28` are served statelessly regardless. `json_response`\nonly *prefers* JSON — the transport falls back to SSE by itself when a handler emits a\nnotification before its result.",
      "type": "object",
      "properties": {
        "legacySessionMode": {
          "description": "Whether handshake-era sessions are created and tracked.",
          "type": "boolean",
          "default": true
        },
        "jsonResponse": {
          "description": "Whether a single JSON response is preferred over an SSE stream.",
          "type": "boolean",
          "default": true
        },
        "sseKeepAliveSeconds": {
          "description": "SSE keep-alive interval, in seconds.",
          "type": "integer",
          "format": "uint64",
          "minimum": 0,
          "default": 15
        }
      }
    },
    "HealthConfig": {
      "description": "What `/-/ready` checks.\n\n`/-/healthz` takes nothing from here: liveness never calls the engine, because a dependency\noutage must not get the pod restarted.",
      "type": "object",
      "properties": {
        "readinessChecksEngine": {
          "description": "Whether readiness also probes the engine.",
          "type": "boolean",
          "default": true
        },
        "engineProbeTimeoutMs": {
          "description": "Timeout for that probe, in milliseconds.",
          "type": "integer",
          "format": "uint64",
          "minimum": 0,
          "default": 2000
        }
      }
    },
    "ObservabilityConfig": {
      "description": "What the server reports about itself.",
      "type": "object",
      "properties": {
        "metricsEnabled": {
          "description": "Whether `/-/metrics` is mounted.",
          "type": "boolean",
          "default": true
        }
      }
    }
  }
}
